{
  "$schema": "https://json-schema.org/draft/2020-12/schema",
  "$id": "https://maxine.local/schemas/maxine_release_candidate_publication_dry_run_sandbox_boundary.schema.json",
  "title": "MAXINE Release Candidate Publication Dry-Run Sandbox Boundary v1",
  "description": "Static sandbox boundary contract for release_candidate_package_publish_dry_run_v1. This contract is not approval, not admission, not execution, not receipt issuance, and not publication.",
  "type": "object",
  "additionalProperties": false,
  "required": [
    "schema_version",
    "record_type",
    "boundary_id",
    "boundary_version",
    "candidate_id",
    "candidate_type",
    "decision_type",
    "sandbox_boundary_status",
    "admission_status",
    "runner_implemented",
    "generated_from_static_artifacts_only",
    "source_artifacts",
    "source_artifact_validation_status",
    "approval_request_ready",
    "operator_approval_granted",
    "approval_phrase_present",
    "dry_run_admitted",
    "dry_run_executed",
    "receipt_issued",
    "publication_admitted",
    "real_execution_admitted",
    "production_ready_claimed",
    "allowed_read_roots",
    "allowed_write_roots",
    "allowed_receipt_roots",
    "allowed_report_roots",
    "allowed_temp_roots",
    "forbidden_roots",
    "forbidden_path_patterns",
    "allowed_file_extensions",
    "forbidden_file_extensions",
    "required_path_normalization",
    "required_output_index",
    "required_hashing",
    "cleanup_rollback_requirements",
    "live_surface_blocks",
    "invalidation_conditions",
    "runner_interface_constraints",
    "future_admission_requirements",
    "unsafe_claims_detected",
    "safety_notes"
  ],
  "properties": {
    "schema_version": {
      "type": "string",
      "const": "1.0.0"
    },
    "record_type": {
      "type": "string",
      "const": "RELEASE_CANDIDATE_PUBLICATION_DRY_RUN_SANDBOX_BOUNDARY_v1"
    },
    "boundary_id": {
      "type": "string",
      "minLength": 1
    },
    "boundary_version": {
      "type": "string",
      "const": "v1"
    },
    "candidate_id": {
      "type": "string",
      "const": "release_candidate_package_publish_dry_run_v1"
    },
    "candidate_type": {
      "type": "string",
      "const": "dry_run"
    },
    "decision_type": {
      "type": "string",
      "const": "non_approval"
    },
    "sandbox_boundary_status": {
      "type": "string",
      "const": "static_boundary_valid_blocked"
    },
    "admission_status": {
      "type": "string",
      "const": "unadmitted"
    },
    "runner_implemented": {
      "type": "boolean",
      "const": false
    },
    "generated_from_static_artifacts_only": {
      "type": "boolean",
      "const": true
    },
    "source_artifacts": {
      "type": "object",
      "additionalProperties": false,
      "required": [
        "candidate_matrix_ref",
        "preflight_contracts_ref",
        "preflight_proof_packages_ref",
        "readiness_rollup_ref",
        "dry_run_plan_ref",
        "dry_run_receipt_contract_ref",
        "blocked_unissued_receipt_ref",
        "admission_blocker_checklist_ref",
        "operator_approval_packet_ref",
        "operator_approval_packet_completeness_ref",
        "approval_request_readiness_ref",
        "non_approval_decision_ref",
        "production_readiness_report_ref",
        "noop_receipt_status_ref"
      ],
      "properties": {
        "candidate_matrix_ref": {
          "type": "string",
          "minLength": 1
        },
        "preflight_contracts_ref": {
          "type": "string",
          "minLength": 1
        },
        "preflight_proof_packages_ref": {
          "type": "string",
          "minLength": 1
        },
        "readiness_rollup_ref": {
          "type": "string",
          "minLength": 1
        },
        "dry_run_plan_ref": {
          "type": "string",
          "minLength": 1
        },
        "dry_run_receipt_contract_ref": {
          "type": "string",
          "minLength": 1
        },
        "blocked_unissued_receipt_ref": {
          "type": "string",
          "minLength": 1
        },
        "admission_blocker_checklist_ref": {
          "type": "string",
          "minLength": 1
        },
        "operator_approval_packet_ref": {
          "type": "string",
          "minLength": 1
        },
        "operator_approval_packet_completeness_ref": {
          "type": "string",
          "minLength": 1
        },
        "approval_request_readiness_ref": {
          "type": "string",
          "minLength": 1
        },
        "non_approval_decision_ref": {
          "type": "string",
          "minLength": 1
        },
        "production_readiness_report_ref": {
          "type": "string",
          "minLength": 1
        },
        "noop_receipt_status_ref": {
          "type": "string",
          "minLength": 1
        }
      }
    },
    "source_artifact_validation_status": {
      "type": "object",
      "additionalProperties": false,
      "required": [
        "candidate_matrix_status",
        "preflight_contracts_status",
        "preflight_proof_packages_status",
        "readiness_rollup_status",
        "dry_run_plan_status",
        "dry_run_receipt_contract_status",
        "blocked_unissued_receipt_status",
        "admission_blocker_checklist_status",
        "operator_approval_packet_status",
        "operator_approval_packet_completeness_status",
        "approval_request_readiness_status",
        "non_approval_decision_status",
        "production_readiness_status",
        "noop_receipt_status"
      ],
      "properties": {
        "candidate_matrix_status": {
          "$ref": "#/$defs/statusValue"
        },
        "preflight_contracts_status": {
          "$ref": "#/$defs/statusValue"
        },
        "preflight_proof_packages_status": {
          "$ref": "#/$defs/statusValue"
        },
        "readiness_rollup_status": {
          "$ref": "#/$defs/statusValue"
        },
        "dry_run_plan_status": {
          "$ref": "#/$defs/statusValue"
        },
        "dry_run_receipt_contract_status": {
          "$ref": "#/$defs/statusValue"
        },
        "blocked_unissued_receipt_status": {
          "$ref": "#/$defs/statusValue"
        },
        "admission_blocker_checklist_status": {
          "$ref": "#/$defs/statusValue"
        },
        "operator_approval_packet_status": {
          "$ref": "#/$defs/statusValue"
        },
        "operator_approval_packet_completeness_status": {
          "$ref": "#/$defs/statusValue"
        },
        "approval_request_readiness_status": {
          "$ref": "#/$defs/statusValue"
        },
        "non_approval_decision_status": {
          "$ref": "#/$defs/statusValue"
        },
        "production_readiness_status": {
          "$ref": "#/$defs/statusValue"
        },
        "noop_receipt_status": {
          "$ref": "#/$defs/statusValue"
        }
      }
    },
    "approval_request_ready": {
      "type": "boolean",
      "const": false
    },
    "operator_approval_granted": {
      "type": "boolean",
      "const": false
    },
    "approval_phrase_present": {
      "type": "boolean",
      "const": false
    },
    "dry_run_admitted": {
      "type": "boolean",
      "const": false
    },
    "dry_run_executed": {
      "type": "boolean",
      "const": false
    },
    "receipt_issued": {
      "type": "boolean",
      "const": false
    },
    "publication_admitted": {
      "type": "boolean",
      "const": false
    },
    "real_execution_admitted": {
      "type": "boolean",
      "const": false
    },
    "production_ready_claimed": {
      "type": "boolean",
      "const": false
    },
    "allowed_read_roots": {
      "$ref": "#/$defs/nonEmptyStringArray"
    },
    "allowed_write_roots": {
      "$ref": "#/$defs/nonEmptyStringArray"
    },
    "allowed_receipt_roots": {
      "$ref": "#/$defs/nonEmptyStringArray"
    },
    "allowed_report_roots": {
      "$ref": "#/$defs/nonEmptyStringArray"
    },
    "allowed_temp_roots": {
      "$ref": "#/$defs/nonEmptyStringArray"
    },
    "forbidden_roots": {
      "$ref": "#/$defs/nonEmptyStringArray"
    },
    "forbidden_path_patterns": {
      "$ref": "#/$defs/nonEmptyStringArray"
    },
    "allowed_file_extensions": {
      "$ref": "#/$defs/nonEmptyStringArray"
    },
    "forbidden_file_extensions": {
      "$ref": "#/$defs/nonEmptyStringArray"
    },
    "required_path_normalization": {
      "$ref": "#/$defs/nonEmptyStringArray"
    },
    "required_output_index": {
      "type": "object",
      "additionalProperties": true
    },
    "required_hashing": {
      "type": "object",
      "additionalProperties": true
    },
    "cleanup_rollback_requirements": {
      "$ref": "#/$defs/nonEmptyStringArray"
    },
    "live_surface_blocks": {
      "$ref": "#/$defs/nonEmptyStringArray"
    },
    "invalidation_conditions": {
      "$ref": "#/$defs/nonEmptyStringArray"
    },
    "runner_interface_constraints": {
      "type": "object",
      "additionalProperties": true
    },
    "future_admission_requirements": {
      "$ref": "#/$defs/nonEmptyStringArray"
    },
    "unsafe_claims_detected": {
      "type": "boolean",
      "const": false
    },
    "safety_notes": {
      "$ref": "#/$defs/nonEmptyStringArray"
    }
  },
  "$defs": {
    "nonEmptyStringArray": {
      "type": "array",
      "minItems": 1,
      "uniqueItems": true,
      "items": {
        "type": "string",
        "minLength": 1
      }
    },
    "statusValue": {
      "type": "string",
      "enum": [
        "pass",
        "warn",
        "fail"
      ]
    }
  },
  "allOf": [
    {
      "properties": {
        "runner_interface_constraints": {
          "properties": {
            "runner_implemented": {
              "const": false
            }
          },
          "required": [
            "runner_implemented"
          ]
        }
      }
    },
    {
      "properties": {
        "allowed_file_extensions": {
          "contains": {
            "const": ".json"
          }
        }
      }
    },
    {
      "properties": {
        "allowed_file_extensions": {
          "contains": {
            "const": ".md"
          }
        }
      }
    },
    {
      "properties": {
        "allowed_file_extensions": {
          "contains": {
            "const": ".txt"
          }
        }
      }
    },
    {
      "properties": {
        "allowed_file_extensions": {
          "contains": {
            "const": ".sha256"
          }
        }
      }
    },
    {
      "properties": {
        "forbidden_roots": {
          "contains": {
            "const": "engine_root_paths"
          }
        }
      }
    },
    {
      "properties": {
        "forbidden_roots": {
          "contains": {
            "const": "production_deployment_paths"
          }
        }
      }
    },
    {
      "properties": {
        "forbidden_roots": {
          "contains": {
            "const": "o3de_cache_paths"
          }
        }
      }
    },
    {
      "properties": {
        "forbidden_roots": {
          "contains": {
            "const": "publish_export_destinations"
          }
        }
      }
    },
    {
      "properties": {
        "forbidden_roots": {
          "contains": {
            "const": "destructive_cleanup_targets"
          }
        }
      }
    },
    {
      "properties": {
        "forbidden_path_patterns": {
          "contains": {
            "const": "parent_traversal"
          }
        }
      }
    },
    {
      "properties": {
        "forbidden_path_patterns": {
          "contains": {
            "const": "absolute_path_escape"
          }
        }
      }
    },
    {
      "properties": {
        "required_path_normalization": {
          "contains": {
            "const": "no_parent_traversal"
          }
        }
      }
    },
    {
      "properties": {
        "required_path_normalization": {
          "contains": {
            "const": "no_symlink_traversal"
          }
        }
      }
    },
    {
      "properties": {
        "required_path_normalization": {
          "contains": {
            "const": "no_junction_traversal"
          }
        }
      }
    },
    {
      "properties": {
        "required_path_normalization": {
          "contains": {
            "const": "canonical_path_must_remain_within_allowed_sandbox_root"
          }
        }
      }
    },
    {
      "properties": {
        "live_surface_blocks": {
          "contains": {
            "const": "o3de_execution"
          }
        }
      }
    },
    {
      "properties": {
        "live_surface_blocks": {
          "contains": {
            "const": "editor_runtime_execution"
          }
        }
      }
    },
    {
      "properties": {
        "live_surface_blocks": {
          "contains": {
            "const": "asset_processor_execution"
          }
        }
      }
    },
    {
      "properties": {
        "live_surface_blocks": {
          "contains": {
            "const": "blender_dcc_execution"
          }
        }
      }
    },
    {
      "properties": {
        "live_surface_blocks": {
          "contains": {
            "const": "spawn"
          }
        }
      }
    },
    {
      "properties": {
        "live_surface_blocks": {
          "contains": {
            "const": "publish_export"
          }
        }
      }
    },
    {
      "properties": {
        "live_surface_blocks": {
          "contains": {
            "const": "cache_live_db_access"
          }
        }
      }
    },
    {
      "properties": {
        "live_surface_blocks": {
          "contains": {
            "const": "production_path_writes"
          }
        }
      }
    },
    {
      "properties": {
        "live_surface_blocks": {
          "contains": {
            "const": "engine_path_writes"
          }
        }
      }
    },
    {
      "properties": {
        "invalidation_conditions": {
          "contains": {
            "const": "write_outside_allowed_sandbox_root"
          }
        }
      }
    },
    {
      "properties": {
        "invalidation_conditions": {
          "contains": {
            "const": "live_tool_or_runtime_invocation_attempt"
          }
        }
      }
    },
    {
      "properties": {
        "invalidation_conditions": {
          "contains": {
            "const": "spawn_or_publish_attempt"
          }
        }
      }
    },
    {
      "properties": {
        "invalidation_conditions": {
          "contains": {
            "const": "receipt_issued_without_explicit_admission"
          }
        }
      }
    },
    {
      "properties": {
        "invalidation_conditions": {
          "contains": {
            "const": "authoritative_id_claim_attempt"
          }
        }
      }
    }
  ]
}
